web-scraper-order,web-scraper-start-url,Product name,author,title,date,content,rating,Page no next,Next Page,Next Page-href
"1693623550-41","https://www.amazon.com/Crocs-Unisex-Classic-Black-Women/product-reviews/B0014C2NBC/","Crocs Unisex-Adult Classic Clogs (Best Sellers), Black, 6 Men/8 Women","My books","They ARE ugly but SO COMFOTABLE!","Reviewed in the United States on July 27, 2023","One thing New Normal seems to be teaching us is  Comfort-Over-Fashion. As a clinician I am so relieved to see so many people preferring to stop the pains-and-perils of fashion ""dictates.""  Crocs may be ugly to some, but the smiles of the wearers are BEAUTIFUL!  While my husband loves his black Crocs, as do most men and women I see wearing this brand, I chose the ""Daffy Duck"" yellow! At 45 I gladly do rounds in my hospital system, wearing these with my pink scrubs...drawing lots of laughter AND questions! You bet, Alegria shoes were originally designed and enjoyed by Nurses (I guess we docs needed more time to ""learn"" of their benefits), they have risen to be among the top healthy, fashionable shoes. I own a lot and love them. But even they can be a bit pricey, and do not address some people's need for a unisex shoe that offers an all-weather inexpensive trial as Crocs do. My husband found his feet had ""shifted"" during the work-from-home-mandate, with slippers becoming his go-to. His narrow feet spread. While Croc sizing fit his usual size, I am finding that many report, like I do, that they require a slightly smaller size. And these shoes tend, at least from patient reports, to run a bit wider than their usual ""fit,"" with a larger toe box size.  Yet I have heard NO complaints, except that most tend to choose darker colors because...well...""they stick out!"" Yep, they do and I LOVE IT!  Comfort is healthy...YEA! Even my husband's formerly extra narrow feet are finding his black Crocs ""a perfect fit.""  I'm doing a happy dance!","5.0 out of 5 stars","2","",""
"1693623555-42","https://www.amazon.com/Crocs-Unisex-Classic-Black-Women/product-reviews/B0014C2NBC/","Crocs Unisex-Adult Classic Clogs (Best Sellers), Black, 6 Men/8 Women","GOD EMPEROR 69","Size Issues!!!","Reviewed in the United States on August 17, 2023","I have owned several pairs of Crocs, but I left the pairs that I currently own at my home in the Philippines, so I wasn't able to check the size. I remember that they always fit real large. So although I wear a size 11, I ordered a size 10. When I received the package the size 10 was so big it would not stay on my feet. I returned them and I'm waiting for another pair in a size 9... I really like Crocs and although they seem light and flimsy they're very comfortable, very well built and last a very long time... I have no issue with the shoes, but when you order just keep in mind to order at least a size or two smaller than you normally wear!!!","5.0 out of 5 stars","3","Next page→","https://www.amazon.com/Crocs-Unisex-Classic-Black-Women/product-reviews/B0014C2NBC/ref=cm_cr_arp_d_paging_btm_2?ie=UTF8&pageNumber=2"
"1693623555-43","https://www.amazon.com/Crocs-Unisex-Classic-Black-Women/product-reviews/B0014C2NBC/","Crocs Unisex-Adult Classic Clogs (Best Sellers), Black, 6 Men/8 Women","Emilio B","The Perfect Gift: Black Crocs - made my sister very happy!","Reviewed in the United States on August 7, 2023","I hit the jackpot with these black Crocs as a Christmas gift for my sister! They've become her ultimate go-to footwear, and it's a joy to see her rocking them with her favorite Nike socks.

These Crocs have become an inseparable part of her daily routine. The comfort they provide is unparalleled, and she raves about how they're like walking on clouds. Whether she's out running errands or just hanging out at home, those black Crocs are her constant companions.

Pairing them with her beloved Nike socks has become her signature look. She's turned comfort into a fashion statement, and honestly, it suits her perfectly. Seeing her happy and stylish is the best gift I could've asked for.

If you're on the hunt for a gift that's both comfy and stylish, these black Crocs are a win-win. They've made my sister's day-to-day life a whole lot more enjoyable, and I couldn't be happier with this choice.","5.0 out of 5 stars","3","Next page→","https://www.amazon.com/Crocs-Unisex-Classic-Black-Women/product-reviews/B0014C2NBC/ref=cm_cr_arp_d_paging_btm_2?ie=UTF8&pageNumber=2"
"1693623555-44","https://www.amazon.com/Crocs-Unisex-Classic-Black-Women/product-reviews/B0014C2NBC/","Crocs Unisex-Adult Classic Clogs (Best Sellers), Black, 6 Men/8 Women","EALong19","I love these things","Reviewed in the United States on August 8, 2023","I have difficult feet. I’ll never be able to wear gorgeous high heels. But I finally found something that will work in the summer (it’s Uggs in the winter) and it’s these.
Yes, I know I just made you throw up with my shoe fashion choices but it’s either that or I sit on a couch all day so people can marvel at my beautiful shoes.
I can walk for miles in these. And they might be back in kitschy fashion (?) I don’t know and I don’t care. I’m just glad I decided to try them. They’re more comfortable than the Birkenstocks I used to get and some of those styles would hurt my feet too. With the strap on the back of these, there’s enough pressure there to keep my feet from clenching each time I lift my foot.
Heaven.","5.0 out of 5 stars","3","Next page→","https://www.amazon.com/Crocs-Unisex-Classic-Black-Women/product-reviews/B0014C2NBC/ref=cm_cr_arp_d_paging_btm_2?ie=UTF8&pageNumber=2"
"1693623555-45","https://www.amazon.com/Crocs-Unisex-Classic-Black-Women/product-reviews/B0014C2NBC/","Crocs Unisex-Adult Classic Clogs (Best Sellers), Black, 6 Men/8 Women","Cameron","Why 5 stars?","Reviewed in the United States on June 29, 2023","Oh, prepare yourself for the most exhilarating review you'll ever read! Brace yourself for a whirlwind of enthusiasm as I sing the praises of your extraordinary Crocs! These footwear wonders have forever altered the trajectory of comfort and style.

Picture this: every step you take feels like a gentle cloud caressing your feet, a dance of sheer bliss. The moment I slipped my feet into those Crocs, my world transformed. It was as if I had discovered the secret to walking on marshmallows while simultaneously defying gravity!

The vibrant colors! Oh, the vibrant colors! With every shade under the sun, my Crocs became a kaleidoscope of joy. I felt like an unstoppable force, radiating positivity and infectious energy wherever I went. People couldn't help but gaze upon my feet in awe, overcome by the sheer magnificence of my Crocs.

But let's not forget the practicality they offer. Rain or shine, these masterpieces fearlessly face any weather condition. Their water-resistant nature is akin to having a personal shield against unexpected downpours. I can confidently conquer puddles, knowing my feet are protected in the fortress of Crocs.

Comfort? Let's just say walking in these wonders is like floating on a cloud of marshmallow fluff. The foam-like material molds perfectly to my feet, embracing them in a tender embrace. It's a symbiotic relationship of foot and shoe, a harmony that can only be described as transcendental.

And oh, the versatility! These Crocs effortlessly transition from casual lounging to outdoor escapades. Whether I'm strolling along the beach or embarking on an impromptu adventure, they're always ready to support me. They are the chameleons of footwear, adapting to any situation without compromising an ounce of style.

But the true magic of these Crocs lies in their ability to make people smile. As I strut down the street, heads turn, faces light up, and smiles spread like wildfire. They are an instant mood booster, a ray of sunshine in a world that sometimes forgets to laugh. These Crocs have the power to make the world a better place, one happy footstep at a time.

In conclusion, my dear friend, your Crocs are not just shoes; they are a gateway to a realm of unimaginable comfort, style, and joy. Prepare to embark on a magical journey every time you slip them on. So, hold on tight and get ready for an extraordinary adventure. Your Crocs await, ready to take you to the heights of foot-fashion ecstasy!","5.0 out of 5 stars","3","Next page→","https://www.amazon.com/Crocs-Unisex-Classic-Black-Women/product-reviews/B0014C2NBC/ref=cm_cr_arp_d_paging_btm_2?ie=UTF8&pageNumber=2"
"1693623555-46","https://www.amazon.com/Crocs-Unisex-Classic-Black-Women/product-reviews/B0014C2NBC/","Crocs Unisex-Adult Classic Clogs (Best Sellers), Black, 6 Men/8 Women","Linda Lincoln","Durable, comfortable, and fits Great!! I would purchase them again!!","Reviewed in the United States on July 14, 2023","The Crocs Unisex-Adult Classic Clogs are a versatile and comfortable choice of footwear suitable for a wide range of occasions. With their iconic design, lightweight construction, and cushioned comfort, these clogs offer a practical and enjoyable wearing experience. Here's my review of the Crocs Unisex-Adult Classic Clogs.

The standout feature of these clogs is their versatility. They can be worn for various activities and settings, from casual outings and outdoor adventures to gardening and quick errands. The classic design and wide range of color options make them suitable for both men and women, allowing for easy styling and personalization.

Comfort is paramount, and the Crocs Classic Clogs excel in this aspect. The clogs are made from Croslite material, which is lightweight and provides excellent cushioning. The soft and supportive footbed ensures all-day comfort, allowing for long hours of wear without fatigue or discomfort. The roomy fit accommodates a variety of foot shapes and sizes, providing a comfortable wearing experience for most individuals. In terms of value for money, the Crocs Unisex-Adult Classic Clogs offer good quality and functionality at an affordable price. The versatility, comfort, and durability make them a worthwhile investment for those seeking practical and comfortable footwear options.

In conclusion, the Crocs Unisex-Adult Classic Clogs are a versatile and comfortable choice for everyday wear. With their lightweight construction, cushioned comfort, and easy maintenance, these clogs provide a practical and enjoyable wearing experience. While the roomy fit and unique design may not suit everyone's preferences, the overall performance and features of the Crocs Unisex-Adult Classic Clogs make them a reliable choice for various activities and occasions.","4.0 out of 5 stars","3","Next page→","https://www.amazon.com/Crocs-Unisex-Classic-Black-Women/product-reviews/B0014C2NBC/ref=cm_cr_arp_d_paging_btm_2?ie=UTF8&pageNumber=2"
"1693623555-47","https://www.amazon.com/Crocs-Unisex-Classic-Black-Women/product-reviews/B0014C2NBC/","Crocs Unisex-Adult Classic Clogs (Best Sellers), Black, 6 Men/8 Women","Bryan Martinez","Praises for Crocs Unisex-Adult Classic Clogs - True to Size, Perfect Fit, and Remarkably Durable!","Reviewed in the United States on July 18, 2023","Dear Fellow Customers,

I hope this letter finds you well. I am writing to express my utmost satisfaction with the purchase of my Crocs Unisex-Adult Classic Clogs from your platform.

First and foremost, I am delighted to highlight that these clogs are indeed true to size. Ordering online can sometimes be a bit nerve-wracking, but I found that the sizing guide provided was accurate, and the clogs fit me perfectly.

Moreover, I am thoroughly impressed with their exceptional fit. The design and materials used seem to mold to my feet, providing an unparalleled level of comfort. I can wear them for extended periods without any discomfort or soreness.

Furthermore, I must commend the outstanding durability of these Crocs. Despite frequent use, they have withstood the test of time and maintained their shape and quality. I feel confident that they will continue to serve me well for a long time to come.

In conclusion, I am extremely satisfied with my purchase of the Crocs Unisex-Adult Classic Clogs from Amazon. The true-to-size fit and remarkable durability have exceeded my expectations. I highly recommend these clogs to anyone in need of reliable and comfortable footwear.

Thank you for offering such an excellent product.

Sincerely,
Bryan","4.0 out of 5 stars","3","Next page→","https://www.amazon.com/Crocs-Unisex-Classic-Black-Women/product-reviews/B0014C2NBC/ref=cm_cr_arp_d_paging_btm_2?ie=UTF8&pageNumber=2"
"1693623555-48","https://www.amazon.com/Crocs-Unisex-Classic-Black-Women/product-reviews/B0014C2NBC/","Crocs Unisex-Adult Classic Clogs (Best Sellers), Black, 6 Men/8 Women","Kristol","So very comfortable","Reviewed in the United States on July 27, 2023","I love these, they are extremely comfortable. I waited a while to review because I wanted to really try them out to see what all of the hype was about.

I love the color, they look exactly as they do in the images. They are light weight, I barely feel like I’m wearing shoes. They are pretty true to size, I would say if you wear a half size, go down not up. At first I thought they were uncomfortable because I have high arches. After some wear, the foam breaks down in all of the right places and you feel support where you need it.

100% recommend!! I want allll of the colors now! Get a few that match with your outfits well. I’m on my feet all day -vet clinic- for work and I won’t go back to any other shoes.","5.0 out of 5 stars","3","Next page→","https://www.amazon.com/Crocs-Unisex-Classic-Black-Women/product-reviews/B0014C2NBC/ref=cm_cr_arp_d_paging_btm_2?ie=UTF8&pageNumber=2"
"1693623555-49","https://www.amazon.com/Crocs-Unisex-Classic-Black-Women/product-reviews/B0014C2NBC/","Crocs Unisex-Adult Classic Clogs (Best Sellers), Black, 6 Men/8 Women","MARTIN","Ugly, but practical and darn comfy","Reviewed in the United States on August 1, 2023","I’d had crocs a long time ago when I was younger, and I had my mind made up that i would never buy a pair. At first, when they began popping up I didn’t understand why they were so popular, and why everyone had them. But a few months ago, I tried a friend’s on, and it was great! I had understood that chefs and cooks had used them for a long time due to comfort, but never understood why; when I tried them on I finally understood. Although being, in my opinion, very ugly, they are extremely comfortable and practical for daily use; they clean and slip on easily. The extra material on the heel is what makes them extremely cushy and snug. Overall, they are a great buy for anyone looking for a functional, soft pair of shoes (although not very pretty).","5.0 out of 5 stars","3","Next page→","https://www.amazon.com/Crocs-Unisex-Classic-Black-Women/product-reviews/B0014C2NBC/ref=cm_cr_arp_d_paging_btm_2?ie=UTF8&pageNumber=2"
"1693623555-50","https://www.amazon.com/Crocs-Unisex-Classic-Black-Women/product-reviews/B0014C2NBC/","Crocs Unisex-Adult Classic Clogs (Best Sellers), Black, 6 Men/8 Women","J. Edwards, Jr","Overall very comfy!","Reviewed in the United States on August 19, 2023","When I was looking at the Crocs it was advised that if you already wear a 1/2 size to bump up to the next size… Well, for me that wasn’t a good suggestion as I normally wear a 10.5 on average amongst shoe manufacturers and when I got the 11’s they were really loose… Well, I ended up ordering a 10 and although the 10’s still feel a bit loose they are definitely better fitting than the 11’s… So, although it’s suggested bump up a size I personally recommend getting both the next size down and next size up to try out and go from there…","5.0 out of 5 stars","3","Next page→","https://www.amazon.com/Crocs-Unisex-Classic-Black-Women/product-reviews/B0014C2NBC/ref=cm_cr_arp_d_paging_btm_2?ie=UTF8&pageNumber=2"
"1693623555-51","https://www.amazon.com/Crocs-Unisex-Classic-Black-Women/product-reviews/B0014C2NBC/","Crocs Unisex-Adult Classic Clogs (Best Sellers), Black, 6 Men/8 Women","Jason Millhouse","The legend. Works great in any wet situation!","Reviewed in the United States on July 24, 2023","Like many, I don't wear them as a style choice. But they are superb for any wet location or chores that involve a lot of water, like pressure washing decks, fences, and houses. The size is true to form and I didn't know they even made them in my size (most shoe brands don't make or at least advertise a 15), or I'd have bought them sooner.

I particularly like how easy they are to spray clean, and leave to dry. In still air, they are dry in a couple hours. With a fan, minutes. Portable, and great for the beach as well! The reason I like them better than flip flops at the beach is that they are structurally more sound which, for older folks, makes it less likely to turn an ankle on some forgiving sand or a slippery rock. Listen, I'm not crazy about their shape or visual design, but they do the job when you need them to with a lot of durabilty. Would buy again, but I can't see ever needing to. They are like tanks!","5.0 out of 5 stars","3","Next page→","https://www.amazon.com/Crocs-Unisex-Classic-Black-Women/product-reviews/B0014C2NBC/ref=cm_cr_arp_d_paging_btm_2?ie=UTF8&pageNumber=2"
"1693623560-52","https://www.amazon.com/Crocs-Unisex-Classic-Black-Women/product-reviews/B0014C2NBC/","Crocs Unisex-Adult Classic Clogs (Best Sellers), Black, 6 Men/8 Women","J. Barz","Very Nice","Reviewed in the United States on July 31, 2023","I've wanted a pair of crocs for a while and was shocked at the price.  When they finally came down to a decent price, I decided to pull the switch, only I waited too long and only had a limited selection for my size.  That said, I am very happy with the color I ended up choosing.  I bought the army green and while they are a bit earthier color than what I was aiming for, the fit and support makes it worth it.  I've worn them scouring the wet backyard looking for the computer mouse my Great Pyrenees stole, wore them while doing laundry and cleaning the house.  They've been comfortable throughout the day - without socks.  Quite pleased.  Hoping they last for a long time!","5.0 out of 5 stars","4","Next page→","https://www.amazon.com/Crocs-Unisex-Classic-Black-Women/product-reviews/B0014C2NBC/ref=cm_cr_arp_d_paging_btm_3?ie=UTF8&pageNumber=3"
"1693623560-53","https://www.amazon.com/Crocs-Unisex-Classic-Black-Women/product-reviews/B0014C2NBC/","Crocs Unisex-Adult Classic Clogs (Best Sellers), Black, 6 Men/8 Women","Kiimm","Sunshine bliss for your feet!","Reviewed in the United States on July 19, 2023","For all you Croc-sters out there, you know what I mean.  For $26.50 what an incredible deal.  Debated  which yellow to get . . . there's the mellow yellow (Banana),  the Sunflower more intense shade and the Lemon so went with the Lemon.  They are the happiest pair of Crocs yet!  I was inspired by another reviewer's hilarious review (Heidi) who posted herself sporting her bright yellow Crocs after apparently becoming a new-found ""Croc believer"" . . lol.  Got such a kick out of her review, just had to get me some yellow ones too. . lol (thank you, Heidi); and after recently swearing an oath to my son that I was NOT going to buy another pair of Crocs ever and that I was done. . yeah right.  These yellow Crocs will jazz up and pop with any outfit for sure. Take it from a 65 year old granny who be lovin' her Crocs. . . :) Move it on over, Imelda Marcos!","5.0 out of 5 stars","4","Next page→","https://www.amazon.com/Crocs-Unisex-Classic-Black-Women/product-reviews/B0014C2NBC/ref=cm_cr_arp_d_paging_btm_3?ie=UTF8&pageNumber=3"
"1693623560-54","https://www.amazon.com/Crocs-Unisex-Classic-Black-Women/product-reviews/B0014C2NBC/","Crocs Unisex-Adult Classic Clogs (Best Sellers), Black, 6 Men/8 Women","Bartek","Comfortable All-Day Footwear Bliss!","Reviewed in the United States on June 16, 2023","The Crocs Unisex-Adult Classic Clog is a true revelation in the realm of comfortable footwear. From the moment I slipped my feet into these clogs, I knew I had discovered the ultimate all-day bliss for my feet.

The iconic design of the Classic Clog is instantly recognizable, and for good reason. The simple yet versatile silhouette pairs effortlessly with any casual outfit, making it suitable for a wide range of occasions. Whether I'm running errands, strolling at the beach, or simply lounging at home, these clogs are my go-to choice.

The comfort provided by these Crocs is unmatched. The cushioned footbed and roomy toe box give my feet ample space to breathe and relax. The lightweight construction ensures that I can wear them for hours on end without feeling any discomfort or fatigue. They truly feel like a cloud hugging my feet.

The Croslite material used in the construction of these clogs is a game-changer. It's not only soft and comfortable but also water-resistant and easy to clean. I can confidently wear them in wet environments or simply toss them in the washing machine to freshen them up—convenience at its finest.

Another fantastic feature of the Classic Clog is its slip-on style. The adjustable heel strap allows for a secure fit and added stability. Whether I choose to wear them with the strap behind my heel or flipped forward for a relaxed fit, they stay firmly in place throughout the day.

The versatility of these clogs is a major selling point. They are unisex and come in a wide range of colors and patterns, allowing everyone to find their perfect match. They are also available in a variety of sizes, ensuring a comfortable fit for both adults and children.

In summary, the Crocs Unisex-Adult Classic Clog is the epitome of comfort, versatility, and convenience. Its iconic design, cushioned footbed, and easy-care materials make it an absolute must-have for anyone seeking all-day foot bliss. I highly recommend these clogs to individuals of all ages who prioritize comfort and style. Slip into a pair of Crocs and experience the joy of happy feet!","5.0 out of 5 stars","4","Next page→","https://www.amazon.com/Crocs-Unisex-Classic-Black-Women/product-reviews/B0014C2NBC/ref=cm_cr_arp_d_paging_btm_3?ie=UTF8&pageNumber=3"
"1693623560-55","https://www.amazon.com/Crocs-Unisex-Classic-Black-Women/product-reviews/B0014C2NBC/","Crocs Unisex-Adult Classic Clogs (Best Sellers), Black, 6 Men/8 Women","Stephanie","Didn’t know I needed it","Reviewed in the United States on August 15, 2023","So I have purchased a few crocs in my time for others as they have become highly requested but never for myself but I finally took the chance and order a pair. My intent was for something with a wide toe space. I am on my feet often and by the end of the evening my feet swell a bit and I am convinced I no longer need to own sneakers after this purchase. Truly if you are in the fence like I was, this is your push to make the purchase, try them out for yourself. You won’t regret it.","5.0 out of 5 stars","4","Next page→","https://www.amazon.com/Crocs-Unisex-Classic-Black-Women/product-reviews/B0014C2NBC/ref=cm_cr_arp_d_paging_btm_3?ie=UTF8&pageNumber=3"
"1693623560-56","https://www.amazon.com/Crocs-Unisex-Classic-Black-Women/product-reviews/B0014C2NBC/","Crocs Unisex-Adult Classic Clogs (Best Sellers), Black, 6 Men/8 Women","MrRobot PartsPlus","Best summer shoes!","Reviewed in the United States on July 17, 2023","I've been a fan for years and the quality is still superb.  Some say they are ugly, but the rest of us silently laugh as we enjoy the ease and comfort these give.

I like that they work in any conditions.  I especially wear them when working in the pig pen. I step in interesting things and no matter how good your boots are something ultimately makes it inside,  which is the worst.  With these I can get a hose and just clean things off. There is almost no job around my property I haven't used them for. The only problem is sticker weeds sometimes.  The holes in the front don't give much protection there.  But they also don't collect burrs and other things that regular shoes do.

My kids all wear them and they like to put those charms on them.  I've seen lights for them and even the bull anatomy thing that you see on some trailer hitches.  I guess if that is what you have to do to feel manly,  then go for it.

I'm a simple guy and love these especially for the simplicity.  I think I'm on my 8th pair now...","5.0 out of 5 stars","4","Next page→","https://www.amazon.com/Crocs-Unisex-Classic-Black-Women/product-reviews/B0014C2NBC/ref=cm_cr_arp_d_paging_btm_3?ie=UTF8&pageNumber=3"
"1693623560-57","https://www.amazon.com/Crocs-Unisex-Classic-Black-Women/product-reviews/B0014C2NBC/","Crocs Unisex-Adult Classic Clogs (Best Sellers), Black, 6 Men/8 Women","The Bean Counter","Perfect Replacement","Reviewed in the United States on August 30, 2023","Great replacement for a pair of 13 yr old size 11 Crocs that had served me well but had seen better days and needed to be retired. I wasn't disappointed as they fit perfectly with no break in needed. I usually don't wear socks with Crocs so I ordered a size 11 even though I wear 12 shoes and the fit was perfect. It's something to keep in mind when ordering them how you will be wearing them as they seem to run a bit large.","5.0 out of 5 stars","4","Next page→","https://www.amazon.com/Crocs-Unisex-Classic-Black-Women/product-reviews/B0014C2NBC/ref=cm_cr_arp_d_paging_btm_3?ie=UTF8&pageNumber=3"
