web-scraper-order,web-scraper-start-url,Product name,author,title,date,content,rating,Page no next,Next Page,Next Page-href
"1693623550-32","https://www.amazon.com/Crocs-Unisex-Classic-Black-Women/product-reviews/B0014C2NBC/","Crocs Unisex-Adult Classic Clogs (Best Sellers), Black, 6 Men/8 Women","Lacie","Newbie Croc wearer answers common questions","Reviewed in the United States on August 17, 2023","SIZING + FIT: 1) I wear an exact women’s size 8.5. Sometimes size 9 so I can add a Dr Scholl arch insole.  I ordered these Crocs in two different sizes so I could try them and return the size that didn’t work. The size women’s 9 was too large/loose. The size women’s 8 fit me best, but not perfect.  2) The right shoe is somewhat larger & looser than the left, and the heel strap is longer.  3) I tried inserting a Dr Scholl insole in these Crocs. It did make the shoes more snug on my feet, and added arch support.  The insoles stayed in place.  But, it just felt wrong to put an insole in a Croc shoe since I bought these for orthopedic comfort & support, so I removed them.  4) My husband also just ordered these exact Crocs from Amazon in size Men's 11.  He normally wears a size 10.5 or 11 shoe. They fit him okay, but they are somewhat loose on his narrow feet and he ends up walking duck-footed, with his toes pointed outward, to keep them from slipping.

COMFORT: 1) After reading A LOT of reviews, I concluded that the comfort of Crocs are unique to each person. People with wider feet seem to really love them. People with foot or back problems love them. People with narrower feet aren’t usually impressed by them.  2) I sit & stand at my desk all day and these shoes are more comfortable than flip flops, but not as comfortable as high quality sneakers.  3) I have high arches and these shoes are tolerable, but don’t really offer much arch support.  Perhaps my feet will eventually mold to the rubber – time will tell.  4) These Crocs have a slight cushioned insole. They are not hard plastic, and the insole has a little bit of cushy give when I take a step.  5) When wearing these shoes for extended periods, I notice pain in the ball of my feet - metatarsals.  6) The little nubs inside these shoes are soft enough that they don’t bother me or hurt my feet. That says a lot because I have very sensitive feet!  7) I find these shoes to be more comfortable and slip less when I wear them with socks.  8) I have a knock-off brand of Crocs with removeable orthopedic insoles. Those were initially comfortable on my feet, but the longer I wore them the more my feet hurt. The knock-off brand cost MORE than these Crocs ($33 vs $26).

LOOKS + COLOR: 1) Well, what can I really say here except I really didn’t buy these for looks. They look like wide orthopedic shoes.  Oh yeah, that’s because they are!  Comfort overruled style in my case.  2) I bought some cute white flower charms on Amazon and that made my Crocs look more feminine and added a little something that was needed.  3) I ordered these in the color CHOCOLATE because I wanted a neutral color that didn’t draw attention to my huge orthopedic shoes. In the listing photo they look kind of sparkly, but they aren’t. They are a light, soft brown, almost a taupe color.  Later, IF this shoe style grows on me (remember, I’m a newbie Crock wearer) I may try some other fun colors like pink or red.

OTHER + GOOD TO KNOW + TIPS:  1) As other reviewers mention, these shoes squeak as you walk. Each step is “squeak, squeak, squeak…”.  2) In my opinion, Crocs are not ideal for narrow feet like mine. The shoes feel loose and I had them slip off while walking, which could be hazardous. I would not walk in these shoes for long distances or on uneven ground or on steps.  3) I heard that Crocs can be loosened or tightened using a blow dryer or in a clothes dryer.  I tried to tighten mine using a blow dryer on high heat, held 6 inches away, then let cool.  I was hoping the material would slightly shrink, especially the heel strap which is too loose.  Unfortunately, this heat method did not work for me. *If you try this, USE CAUTION so you don't ruin your shoes!  4) I read many reviews where people said their Crocs shrunk or warped when left out in the sun or in a hot vehicle , so keep that in mind.  5) The holes in the plastic help ventilate enough that my feet don’t get super hot. Yes, my feet sweat a little in these shoes. There is a slight foot odor when wearing without socks. That is to be expected with rubber shoes.  6) I prefer to wear these shoes with socks because it helps with sweating and my feet don’t slip as much.  7) The tag on these shoes says Made in China. The bottom of the shoe is imprinted with Made in China. They have a tag that warns about riding on escalators and holding children’s hands at all times. I would never wear these on an escalator, but there must be some reason they include this tag – probably because of known issues of the rubber soles getting stuck on escalators.  8) I have no idea if these are “authentic” Crocs because this is my first pair and I have nothing to compare to.  I checked the official Crocs’ website and the shoes I received from Amazon look exactly like those on Crocs’ website.  9) At the time of this review, I paid $26 for these Crocs on Amazon.  This same style on the official Crocs’ website is priced much higher at $49. Amazon offers a lot more color options than Crocs’ website.  10) I found where Amazon sells a slightly different style of Croc brand shoes that I might try “Crocs Unisex-Adult All Terrain Clogs with Adjustable Heel Strap”.  The adjustable heel strap may help in keeping my feet from sliding around. That style is a lot pricier at $41.

IN CONCLUSION: As a newbie Croc wearer, I am not totally convinced these shoes live up to all the hype and amazing reviews I read.  Like I said, I don’t think these are ideal for my narrow feet. I don’t feel safe wearing these outside my house because my feet slip in them so much.  I will most likely wear these inside my house, inside my RV or around the campsite.  PS- I am really disappointed that these didn’t meet all my expectations, and I am envious of all the people who rave about these shoes.

I paid full price for these Crocs and was not compensated in any way for this review. I hope you found it helpful.","4.0 out of 5 stars","2","",""
"1693623550-33","https://www.amazon.com/Crocs-Unisex-Classic-Black-Women/product-reviews/B0014C2NBC/","Crocs Unisex-Adult Classic Clogs (Best Sellers), Black, 6 Men/8 Women","Dan Sadwick","Air-Conditioned Heaven","Reviewed in the United States on August 23, 2023","Crocs are arguably the greatest invention of all time, I think we can all agree on that. They're basically an air-conditioned piece of heaven for your feet. It's as if Michael Jordan, John Daly, and Jesus Christ Him/Herself got together and created the ultimate ""do anything, anytime, anywhere in whatever weather shoe"". That's what these puppies are. I can without a doubt say that your dogs will not be barkin' after wearing these magnificent pieces of pure genius.

With that being said, you should consider shifting these babies into sports mode more often than not. Last night, as I was walking up my stairs (which by the way, felt like the stairway to heaven in these majestical pieces of art), the grip (which is also incredible under any condition) was too much for my steps and I slipped right out of them. As I tumbled down the stairs, I couldn't help but think, this is probably what Samael felt like when Michael the Arch Angel had thrown him out of heaven. As I desperately tried to grasp anything in sight, like Samael tried to grab Michael, all I could see were my two, beautiful blue crocs planted on the stairs. After my terrifying descent down this stairway to heaven, I realized I had succumbed to some minor injuries, including a sprained ankle and bruised forearm. As I sat at the bottom of these godforsaken steps, my stunning blue crocs, still firmly positioned on the steps, stared at me in a way that I can only describe as mosses seeing the burning bush. As I gazed further into the blue, the sport mode straps said nothing, but also everything all at once.  It was truly a lesson I will never forget.

So that's what brings me here today. Don't be like me. If ever in doubt, flip these bad boys into sport mode and march on solider.","5.0 out of 5 stars","2","",""
"1693623550-34","https://www.amazon.com/Crocs-Unisex-Classic-Black-Women/product-reviews/B0014C2NBC/","Crocs Unisex-Adult Classic Clogs (Best Sellers), Black, 6 Men/8 Women","pkway","There's a reason why people in the service industry all wear Crocs","Reviewed in the United States on August 21, 2023","Hold onto your socks (or not, because who needs 'em?) because I'm about to unleash the craziest review you've ever read about the Crocs Unisex-Adult Classic Clogs in black! Strap in – or should I say, strap on – because these clogs are a rollercoaster of comfort and style that'll have you questioning everything you thought you knew about footwear.

Let's talk about the color: black. It's like the ninja of colors, sleek and mysterious. These Classic Clogs are the Batman of shoes, ready to swoop in and save the day with their unparalleled comfort and distinctive charm. They're like the Swiss Army knife of footwear – versatile, ready for anything, and undoubtedly the most low-key superhero in your closet.

Now, let's address the elephant in the room: the iconic Crocs design. Some might say they're the mullet of shoes – business in the front, party in the back. But hey, who doesn't love a good surprise? The holes? They're not just for looks; they're like tiny windows into a world of aeration and ventilation, making sure your feet stay cooler than a polar bear's toenails even on the hottest days.

And the comfort level? It's like walking on clouds made of marshmallows. You'll feel like you're floating on a fluffy bed of unicorns and rainbows, no matter where you go. Need to run errands? Crocs got you. Lounging at home? Crocs got you. Attending a fancy gala (virtual or not)? You betcha, Crocs still got you.

Don't be surprised if, after slipping your feet into these bad boys, you suddenly start speaking fluent dolphin – that's the kind of transformative power these Crocs possess. They're the ultimate icebreakers, conversation starters, and possibly even the key to unlocking world peace.

In conclusion, the Crocs Unisex-Adult Classic Clogs in black are a masterpiece of footwear evolution. They're the Picasso of clogs, the Shakespeare of shoes, and the Beyoncé of comfort. So, go ahead, embrace the wild side of fashion, slip into these babies, and get ready for a life-altering journey – one step at a time.","5.0 out of 5 stars","2","",""
"1693623550-35","https://www.amazon.com/Crocs-Unisex-Classic-Black-Women/product-reviews/B0014C2NBC/","Crocs Unisex-Adult Classic Clogs (Best Sellers), Black, 6 Men/8 Women","Ray","The Perfect Combination of Comfort and Style","Reviewed in the United States on July 5, 2023","I recently purchased the Crocs Unisex-Adult Classic Clogs, and I must say, they have quickly become my go-to footwear for running errands and everyday activities. These clogs offer a perfect combination of comfort, functionality, and style.

First and foremost, the fit is absolutely spot on. Crocs are known for their comfortable fit, and these Classic Clogs are no exception. The unisex sizing ensures a snug fit without being too tight or too loose. I appreciate how they securely hug my feet, allowing me to walk with confidence and ease.

Comfort is where these clogs truly shine. The cushioned footbed provides excellent support, making it feel like I'm walking on clouds. Whether I'm standing for extended periods or walking long distances, my feet remain comfortable and pain-free. The roomy toe box allows for natural movement and prevents any discomfort or rubbing.

One of the standout features of these Classic Clogs is their versatility. They are perfect for running errands, casual outings, or simply relaxing around the house. The slip-on design makes them incredibly convenient, allowing me to effortlessly slide them on and off whenever needed. I especially love how they offer quick and easy protection for my feet, whether I'm stepping outside to grab the mail or taking a short walk.

In terms of style, the Crocs Classic Clogs have an understated charm. They may not be the most glamorous footwear option, but they have a certain appeal that adds a touch of cuteness to any outfit. The variety of color options allows you to choose the one that best suits your personal style.

Durability is another key factor to consider, and these clogs certainly deliver. The high-quality materials used in their construction ensure longevity, even with regular wear. The water-resistant nature of the clogs makes them suitable for various weather conditions, and they are easy to clean, maintaining their fresh appearance.

In conclusion, the Crocs Unisex-Adult Classic Clogs are a fantastic choice for anyone seeking comfortable, versatile, and cute footwear. With their perfect fit, exceptional comfort, and stylish appearance, they have quickly become a staple in my daily wardrobe. Whether you're running errands, lounging at home, or enjoying casual outings, these clogs are sure to keep your feet happy. I highly recommend them to anyone in search of the ultimate combination of comfort and style.","5.0 out of 5 stars","2","",""
"1693623550-36","https://www.amazon.com/Crocs-Unisex-Classic-Black-Women/product-reviews/B0014C2NBC/","Crocs Unisex-Adult Classic Clogs (Best Sellers), Black, 6 Men/8 Women","Tim Faucett","Black Crocks","Reviewed in the United States on August 22, 2023","So my last pair has lasted around 5 years. Still wear them when mowing. Always recommend this product. Don't like turning the big 51. Because to me the Big business is taking advantage of us in price gouging.

Living on a limited budget I make sure to just spend a little bit more to get awesome stuff. You kinda get what you pay for. Parents taught me that. Do your research, but don't over analyze it. People get to picky. Either try one or move on.

These are my favorite shoes. Especially since I've become a recipient of Social Security Disability. It's not my choice but my health issues. Plus was cursed with flat and wide feet. Could be a blessing. That's my opinion.

So order this product for everyone in your family and friends. You'd be a great friend to buy for others. When you share and show great kindness it will come full circle.

Bought two pairs of this product. Because of 51st birthday. Anyhow they're AWESOME AND DEPENDABLE.

To another awesome day in paradise. Stay positive and safe. Wishing everyone the best. Will see you 8n the next positive review. If you got questions feel free to ask. Smiles all around.","5.0 out of 5 stars","2","",""
"1693623550-37","https://www.amazon.com/Crocs-Unisex-Classic-Black-Women/product-reviews/B0014C2NBC/","Crocs Unisex-Adult Classic Clogs (Best Sellers), Black, 6 Men/8 Women","Qwrts","Comfortable and Versatile: A Staple for Any Wardrobe","Reviewed in the United States on July 15, 2023","I recently purchased the Crocs Unisex-Adult Classic Clogs, and I have been thoroughly impressed with their comfort, versatility, and durability. These clogs have quickly become a staple in my footwear collection, and I believe they offer outstanding value for anyone seeking a reliable and comfortable pair of shoes.

First and foremost, the level of comfort provided by these Classic Clogs is exceptional. The Croslite material used in their construction offers a plush and supportive feel, ensuring that my feet remain comfortable even during extended periods of wear. The clogs provide a cushioned experience that adapts to the shape of my feet, making them ideal for all-day use.

What sets these clogs apart is their remarkable versatility. They effortlessly complement a wide range of outfits and can be worn in various settings. Whether I'm running errands, taking a leisurely stroll, or enjoying outdoor activities, the Classic Clogs provide reliable support and comfort. Their slip-on design allows for quick and easy wear, making them a convenient choice for busy days.

Durability is another notable aspect of these clogs. The high-quality construction ensures they can withstand regular use and remain in excellent condition over time. Despite owning them for several months, they have shown minimal signs of wear and still retain their original appeal. Additionally, the lightweight design adds to their overall appeal, making them an excellent option for travel or when you need to pack light.

It is worth noting that sizing is important for an optimal fit. Following the Crocs size guide is recommended to ensure the right fit for your feet. The clogs should offer a roomy feel, allowing for comfortable movement without compromising support. This unique fit enhances the overall comfort and adds to the distinctiveness of these clogs.

In conclusion, the Crocs Unisex-Adult Classic Clogs deliver exceptional comfort, versatility, and durability. Their ability to effortlessly blend with different outfits and provide reliable performance makes them an indispensable addition to any wardrobe. Based on my personal experience, I highly recommend these Classic Clogs to anyone in search of comfortable and versatile footwear options.

Please note that this review reflects my personal experience and opinion, and individual preferences may vary.","5.0 out of 5 stars","2","",""
"1693623550-38","https://www.amazon.com/Crocs-Unisex-Classic-Black-Women/product-reviews/B0014C2NBC/","Crocs Unisex-Adult Classic Clogs (Best Sellers), Black, 6 Men/8 Women","Dana","Crocs - MUST HAVE COMFY SHOE","Reviewed in the United States on August 22, 2023","Crocs or any clog shoes for that matter are very much in and I see why — THEY ARE SO COMFORTABLE!

I got a Size 8 White color.

CLEANING: I was hesitant to buy white due to the possibility of getting dirty but took chances and got it. I have zero regrets — I have worn them a handful of times, but even when stained a bit, it was a breeze to clean by wiping down with a wash cloth, water, and soap (if need be).

SIZING: If you are in between sizes, I recommend sizing down. I am an 8 and ordered 9 but they were too big, so I had to get an 8 which was much better.

COMFORTABILITY AND USE: I wear these to the gym and they are comfortable and durable even during intense rotors including weight lifting.

PRICING: I got mine around $32 in July. As I’m making this review in August they are almost $50. I like them a lot as you can’t compare the quality to other clog knockoffs. I’d recommend to purchase still especially for healthcare professionals, athletes, or anyone just wanting a pair of cute comfortable shoes.","5.0 out of 5 stars","2","",""
"1693623550-39","https://www.amazon.com/Crocs-Unisex-Classic-Black-Women/product-reviews/B0014C2NBC/","Crocs Unisex-Adult Classic Clogs (Best Sellers), Black, 6 Men/8 Women","Kevin","Crocs Unisex-Adult Classic Clogs - A Timeless Comfort for All Ages!","Reviewed in the United States on August 5, 2023","Attention all comfort seekers, fashion enthusiasts, and trendsetters - indulge in the Crocs Unisex-Adult Classic Clogs! These clogs are not just any ordinary footwear; they are a timeless comfort that transcends age, offering an unbeatable combination of style and versatility!

Firstly, the ""Crocs"" brand is like a symbol of comfort innovation. It's like these classic clogs have been crafted with a touch of magic that hugs your feet in a cloud of comfort, making every step feel like a dream!

The ""Unisex-Adult"" feature is more than just inclusive; it's like these clogs are a universal symbol of comfort, designed to cater to all ages and styles, from the young at heart to the wise in years!

But here's the real magic - the ""Classic Clogs"" are like an everlasting fashion statement. It's like these clogs have stood the test of time, making them a versatile addition to any outfit, be it casual or chic!

The ""Comfortable Versatility"" is more than just a tagline; it's like these clogs know how to effortlessly switch from outdoor adventures to indoor coziness, making them the ultimate footwear for any occasion!

In conclusion, the Crocs Unisex-Adult Classic Clogs are a timeless comfort for all ages that deserve a glowing review! If you're a comfort seeker, style lover, or simply seeking versatile footwear, these classic clogs are an essential addition to your wardrobe! Crocs, you've created a footwear sensation! Bravo for adding a touch of comfort, style, and versatility to our fashion adventures! May these classic clogs continue to bring us comfort and style, season after season!","5.0 out of 5 stars","2","",""
"1693623550-40","https://www.amazon.com/Crocs-Unisex-Classic-Black-Women/product-reviews/B0014C2NBC/","Crocs Unisex-Adult Classic Clogs (Best Sellers), Black, 6 Men/8 Women","PT Cruiser","Better than flip flops. The more sophisticated choice. 😁","Reviewed in the United States on May 4, 2023","After all these years, (74) this is the first pair of Croc’s that I’ve ever purchased. I’ve tried plastic type shoes in the past that always made my feet feel too warm and sweaty, so I stayed away from these. But I read an article the other day about how the Croc brand was becoming more popular, given a boost by Covid and so many people working from home or just hanging out at home more and buying them. So I took a chance and ordered these Classic Navy Crocs.

When the package arrived, I couldn’t believe how unbelievably light in weight they are. I ordered a size 9 which is pretty much what I wear these days. They looked big and clunky and my toe comes quite a ways from the top, but the fit is actually perfect. I thought they would fall off when I walked, but that is not a problem at all. They stay on whether I flip the strap up, or down around the back of my heels. I have never had them slip off so far. When the strap is down around my heel, it fits loosely, but I have to use my other foot or hand to move it down to remove them. When I put it up over the top, I can slip them on and off easier, but they still don’t come off when I’m walking. Maybe that’s due to the little slightly raised dots all over the inside footbed. Just enough to keep my feet from slipping, but not enough to be uncomfortable. There is only the slightest arch support although I tried a pair of thin shoe pads which gave them some cush, a little support, and are pretty much invisible. But they did make my feet sweat a little due to the slightly snugger fit.

Although there isn’t much cush to them, they don’t feel real hard either. We have tile floors throughout most of our downstairs and they aren’t quite as hard as walking on the floor. I slip them on first thing in the morning, so I guess they are comfortable in their own way. I go barefoot indoors most of the summer anyway, so it isn’t really an issue. These are like going  barefoot with the advantage of protecting the sole of your foot if you step on prickly things. Or in the dog poop on the sidewalk that you didn’t notice. Speaking of dog poop, tyou can use as much soap and water on these as you want without harming them and they air dry in minutes or dry off with a towel or paper towel instantly.

They certainly are ugly looking, but they grow on you. Sort of like a Bulldog or Persian cat. Within a short while you grow to love them. In fact, I bought a second pair of classic light tie dye Crocs which my Amazon driver delivered yesterday. OMG, light, bright and colorful! Just the thing an old hippie like me could fall in love with! Even my husband said he liked them. (Said he didn’t think he would ever wear anything like that, but he commented on them several times throughout the day.) They even make a pair of Jimmy Buffet beach Crocs with lime, umbrella, ice cubes and even the “lost shaker of salt” Jibbitz. Very cool for a Parrothead, but can’t imagine those accessories that look like they could be dog toys staying on the Crocs!

I’ve only had these around a week, so I can’t say how long they’ll last, but they feel sturdy and well made in spite of their incredible lightness.","5.0 out of 5 stars","2","",""
