web-scraper-order,web-scraper-start-url,Product name,author,title,date,content,rating,Page no next,Next Page,Next Page-href
"1693623535-1","https://www.amazon.com/Rain-X-Latitude-Water-Repellency-Wiper/product-reviews/B084CT24NM/","Rain-X - 810165 Latitude Water Repellency Wiper Blade, 22 Inch - 2 Pack","Justin Thurston","Good product with stupid packaging.","Reviewed in the United States on July 28, 2023","I opened these, and looked at the back for directions. I saw what appeared to be directions saying the easy install clip could easily slide on most types types of wipers, and a QR code to watch a video if I found the task too challenging.

I slid the wipers on, and it was easy and quick. Very cool design! I thought my task was complete. 200 miles later, I realized I made mistake of forgetting to remove the protective plastic cover.

You are probably assuming I am just an idiot - which might be true. However, every wiper blade I have bought in my life has had no cover, or a cheap, clear plastic cover that went around the blade. This cover is a soft, hoity toity yellow plastic. At first, I did think it was a removable cover, but I thoroughly inspected it to make sure. After feeling the quality of the material, and noticing that there is a special groove cut into the blade that this insert slides into, I thought, ""Given this level of care and craftsmanship, it is surely an integral part of the blade - it must be where the Rain-X power comes from! The distinctive yellow color is telling me that this is not just something to be thrown away!""

I sprayed wiper fluid on my windshield, with covers intact, and it worked! It wasn't an amazing clean, but was about as good as my old blade I replaced. I guess the Rain-X fluid must have washed off the blade a bit and landed on the windshield enough to give me some visibility. I have driven for the better part of a week, including through a rain storm, and these damn covers did not fall off, and allowed me to see.

To add insult to injury, when I finally pulled off the covers, the hidden part recessed within the body of the wiper blade read ""remove cover before using"".","4.0 out of 5 stars","2","",""
"1693623535-2","https://www.amazon.com/Rain-X-Latitude-Water-Repellency-Wiper/product-reviews/B084CT24NM/","Rain-X - 810165 Latitude Water Repellency Wiper Blade, 22 Inch - 2 Pack","Honestreview","The Best...","Reviewed in the United States on August 27, 2023","Cannot go wrong with these wipers. They hug your windshield glass for a total and clean wipe, unlike the cheap ridged ones that leave streaks across your windshield. Depending on your amount of driving, they will last a year or two. If you would like to extend their life, Just take a paper towel with vinegar and clean the black grime buildup, and they will last even longer. Once I tried these, there is no way I will go back to regular wipe blades.","5.0 out of 5 stars","2","",""
"1693623535-3","https://www.amazon.com/Rain-X-Latitude-Water-Repellency-Wiper/product-reviews/B084CT24NM/","Rain-X - 810165 Latitude Water Repellency Wiper Blade, 22 Inch - 2 Pack","Dani and Christopher","The beads of water are magical","Reviewed in the United States on August 30, 2023","The wipers are great but the real magic is the beads of water! The wipers have some sort of product on them that causes the water to bead up and it makes it so you barely need to use the wipers.

If I could change one thing, I'd make the rectangular part of the wiper, where it attaches, smaller. It doesn't obstruct my vision but I notice it while I'm driving.","5.0 out of 5 stars","2","",""
"1693623535-4","https://www.amazon.com/Rain-X-Latitude-Water-Repellency-Wiper/product-reviews/B084CT24NM/","Rain-X - 810165 Latitude Water Repellency Wiper Blade, 22 Inch - 2 Pack","Justen Kessman","Easy to install work great","Reviewed in the United States on August 29, 2023","These were a great replacement for my old wiper blades. The old ones would streak and leave the window fogged/cloudy for a few seconds after each pass which made it even harder to see during heavy rain. These solved that problem, and installation took less than 5 minutes","5.0 out of 5 stars","2","",""
"1693623535-5","https://www.amazon.com/Rain-X-Latitude-Water-Repellency-Wiper/product-reviews/B084CT24NM/","Rain-X - 810165 Latitude Water Repellency Wiper Blade, 22 Inch - 2 Pack","Dhoward","These are best on the market","Reviewed in the United States on August 27, 2023","The is the second set I bought for a different vehicle. I’ve had no pro problems with the blades or the rain x  solution on the wipers. They continue to out preform any other blade. The fit different types of vehicles so make sure you choose the right ones. Highly recommend","5.0 out of 5 stars","2","",""
"1693623535-6","https://www.amazon.com/Rain-X-Latitude-Water-Repellency-Wiper/product-reviews/B084CT24NM/","Rain-X - 810165 Latitude Water Repellency Wiper Blade, 22 Inch - 2 Pack","BSK","These are really great wipers.","Reviewed in the United States on August 23, 2023","Bought these wipers to replace the worn ones on my Tahoe. They were very easy to install and worked great. Keeps windshield clear even during a torrential downpour. The quality and price was very good. They are very sturdy, not flimsy like some wipers.  I will definitely purchase this brand again when I require new wipers again.","5.0 out of 5 stars","2","",""
"1693623535-7","https://www.amazon.com/Rain-X-Latitude-Water-Repellency-Wiper/product-reviews/B084CT24NM/","Rain-X - 810165 Latitude Water Repellency Wiper Blade, 22 Inch - 2 Pack","Crissy Pence","Best wipers we’ve ever owned!","Reviewed in the United States on August 13, 2023","My boyfriend was upset I bought wipers without his opinion of what to get until we received them and used them. Now… he’s super happy and thinks they are the best wipers on planet Earth so I told him to have faith in my decisions from here on out. They have this bead technology that is out of this world and makes it so much easier to see when it’s raining. They came in a pack of two, they were affordable, Amazon ships fast… like, you won’t regret this purchase! A+","5.0 out of 5 stars","2","",""
"1693623535-8","https://www.amazon.com/Rain-X-Latitude-Water-Repellency-Wiper/product-reviews/B084CT24NM/","Rain-X - 810165 Latitude Water Repellency Wiper Blade, 22 Inch - 2 Pack","Love My GSD","VERY VERY DIFFICULT to install.....","Reviewed in the United States on July 25, 2023","I had started a return on this and the 17 inch Rain x blades  I'd bought because I couldn't get the latch/lock to close over the J hook on the arm----turns out the blade must be pulled so darn hard into the J hook you feel as if you're going to break/damage the new blade--i finally managed to get both blades on & locked....I wonder what they'll be like to get off when time comes to replace them......I can't speak to longevity obviously---but would I recommend these Rain X blades ??......NOPE

This is a edit----I think it needs mentioning that the car I was attempting this install on--- is a 2015 Subaru Forester----every one may not have my issues on their own vehicle...","4.0 out of 5 stars","2","",""
"1693623535-9","https://www.amazon.com/Rain-X-Latitude-Water-Repellency-Wiper/product-reviews/B084CT24NM/","Rain-X - 810165 Latitude Water Repellency Wiper Blade, 22 Inch - 2 Pack","James S.","Easy to install, work great","Reviewed in the United States on August 12, 2023","So far I like  everything about these wiper blades.
The only question is how long they will last. This is my first time using them and I bought them to replace another brand I found on Amazon, used 2 sets, each lasting a year or so, but now are no longer available. If these don't last I'll be sure to update my review, but I feel like they will.","5.0 out of 5 stars","2","",""
"1693623535-10","https://www.amazon.com/Rain-X-Latitude-Water-Repellency-Wiper/product-reviews/B084CT24NM/","Rain-X - 810165 Latitude Water Repellency Wiper Blade, 22 Inch - 2 Pack","Jon V","Decent","Reviewed in the United States on August 23, 2023","Cheaper than getting them at a store and paying to have them put on. They work well, but they did leave a black streak on the windshield after installing and running them dry on the windshield (per instructions), however that washed away after the first rain","4.0 out of 5 stars","2","",""
"1693623540-11","https://www.amazon.com/Rain-X-Latitude-Water-Repellency-Wiper/product-reviews/B084CT24NM/","Rain-X - 810165 Latitude Water Repellency Wiper Blade, 22 Inch - 2 Pack","Wil-Gil","Works like a charm","Reviewed in the United States on August 16, 2023","I really can’t complain about these. These bad boys are legit and worth the price I paid at the time. It definitely helps more if you combine with the rainx washer fluid. Even with out, these are dope!

Visibility & durabilty is 💯 Rainx is my go to 🤞🏽","5.0 out of 5 stars","3","Next page→","https://www.amazon.com/Rain-X-Latitude-Water-Repellency-Wiper/product-reviews/B084CT24NM/ref=cm_cr_arp_d_paging_btm_2?ie=UTF8&pageNumber=2"
"1693623540-12","https://www.amazon.com/Rain-X-Latitude-Water-Repellency-Wiper/product-reviews/B084CT24NM/","Rain-X - 810165 Latitude Water Repellency Wiper Blade, 22 Inch - 2 Pack","Brian C","Great Product","Reviewed in the United States on August 30, 2023","Easy to install, and compared to my old wiper, this thing is amazing. My old wiper left gaps in clearing rain, this thing leaves nothing behind.","5.0 out of 5 stars","3","Next page→","https://www.amazon.com/Rain-X-Latitude-Water-Repellency-Wiper/product-reviews/B084CT24NM/ref=cm_cr_arp_d_paging_btm_2?ie=UTF8&pageNumber=2"
"1693623540-13","https://www.amazon.com/Rain-X-Latitude-Water-Repellency-Wiper/product-reviews/B084CT24NM/","Rain-X - 810165 Latitude Water Repellency Wiper Blade, 22 Inch - 2 Pack","Zonie","Follow install instruction on packaging.","Reviewed in the United States on August 24, 2023","Installed on 2013 F-150. Watch video on Rain-X website for installation. U.S. part# on packaging is 5079279-2. Amazon has part# as 810165. Amazons' website did say this wiper would fit and it did.","5.0 out of 5 stars","3","Next page→","https://www.amazon.com/Rain-X-Latitude-Water-Repellency-Wiper/product-reviews/B084CT24NM/ref=cm_cr_arp_d_paging_btm_2?ie=UTF8&pageNumber=2"
"1693623540-14","https://www.amazon.com/Rain-X-Latitude-Water-Repellency-Wiper/product-reviews/B084CT24NM/","Rain-X - 810165 Latitude Water Repellency Wiper Blade, 22 Inch - 2 Pack","RobC","Definitely fits 2014 Toyota Avalon Hybrid BUT!  Read on","Reviewed in the United States on July 11, 2023","I followed the instructions and saw again and again how easy it was.  But why wasn't  it easy for me?  I tried over and over to snap in that front clip but it would not snap in.  I did it 20 times, no luck, so I came inside cursing at the company and Amazon for saying it fit my car, but then did a web search outside of Amazon to see if anyone else had this issue, and they did!  It seems that this particular car's J hook requires that you use BIG TIME strength to push the clip into the wiper till you hear it go CLICK, and then it is easy to close the snap!  Whew, thank you person who posted that video.  So I am sharing it with you and the others who could not close the clip!","5.0 out of 5 stars","3","Next page→","https://www.amazon.com/Rain-X-Latitude-Water-Repellency-Wiper/product-reviews/B084CT24NM/ref=cm_cr_arp_d_paging_btm_2?ie=UTF8&pageNumber=2"
"1693623540-15","https://www.amazon.com/Rain-X-Latitude-Water-Repellency-Wiper/product-reviews/B084CT24NM/","Rain-X - 810165 Latitude Water Repellency Wiper Blade, 22 Inch - 2 Pack","Holman D.","Easy to install","Reviewed in the United States on August 2, 2023","Followed the instructions for the 'hook' type of windshield wipers suitable for my vehicle. Note: the instructions on the label are for multiple types of windshield wiper installations, just be sure to follow the correct one. It was very simple, there were two plastic pieces you need to pry off using your nails and fingers and then install it. 2-3 minutes tops. They clean great! Waiting to see how long they last.","4.0 out of 5 stars","3","Next page→","https://www.amazon.com/Rain-X-Latitude-Water-Repellency-Wiper/product-reviews/B084CT24NM/ref=cm_cr_arp_d_paging_btm_2?ie=UTF8&pageNumber=2"
"1693623540-16","https://www.amazon.com/Rain-X-Latitude-Water-Repellency-Wiper/product-reviews/B084CT24NM/","Rain-X - 810165 Latitude Water Repellency Wiper Blade, 22 Inch - 2 Pack","A. Santiago","Fits 2020 Crosstrek Ltd","Reviewed in the United States on August 14, 2023","Replaced the factory wipers on my 2020 Subaru Crosstrek Ltd. My Amazon profile says these 26"" and 16"" Rain X wipers would not fit, but I chanced it anyway. I'm glad I did. The test run made me realize factory wipers are trash. Wish I had bought these from the beginning.","5.0 out of 5 stars","3","Next page→","https://www.amazon.com/Rain-X-Latitude-Water-Repellency-Wiper/product-reviews/B084CT24NM/ref=cm_cr_arp_d_paging_btm_2?ie=UTF8&pageNumber=2"
"1693623540-17","https://www.amazon.com/Rain-X-Latitude-Water-Repellency-Wiper/product-reviews/B084CT24NM/","Rain-X - 810165 Latitude Water Repellency Wiper Blade, 22 Inch - 2 Pack","Gary","very good","Reviewed in the United States on August 20, 2023","I think I didn't pay attention to the product description, I only received one, so, it is left and right? Who can answer me? Should I buy another one to make it perfect?","5.0 out of 5 stars","3","Next page→","https://www.amazon.com/Rain-X-Latitude-Water-Repellency-Wiper/product-reviews/B084CT24NM/ref=cm_cr_arp_d_paging_btm_2?ie=UTF8&pageNumber=2"
"1693623540-18","https://www.amazon.com/Rain-X-Latitude-Water-Repellency-Wiper/product-reviews/B084CT24NM/","Rain-X - 810165 Latitude Water Repellency Wiper Blade, 22 Inch - 2 Pack","Cburner26","Works good….","Reviewed in the United States on August 27, 2023","Decent price, works good but one of wipers won’t lock onto wiper holder’s.","4.0 out of 5 stars","3","Next page→","https://www.amazon.com/Rain-X-Latitude-Water-Repellency-Wiper/product-reviews/B084CT24NM/ref=cm_cr_arp_d_paging_btm_2?ie=UTF8&pageNumber=2"
"1693623540-19","https://www.amazon.com/Rain-X-Latitude-Water-Repellency-Wiper/product-reviews/B084CT24NM/","Rain-X - 810165 Latitude Water Repellency Wiper Blade, 22 Inch - 2 Pack","JMiller","Work well on FJ","Reviewed in the United States on August 5, 2023","I didn't think a beam blade was good for my Toyota FJ given my slightly flat, Jeep-like windshield. I was so wrong. These replaced RainX Weatherbeaters. Three months in driving all over the country, I have not found better blades. I don't know what really expensive blades are like but for my fixed income, these are a godsend.","4.0 out of 5 stars","3","Next page→","https://www.amazon.com/Rain-X-Latitude-Water-Repellency-Wiper/product-reviews/B084CT24NM/ref=cm_cr_arp_d_paging_btm_2?ie=UTF8&pageNumber=2"
"1693623540-20","https://www.amazon.com/Rain-X-Latitude-Water-Repellency-Wiper/product-reviews/B084CT24NM/","Rain-X - 810165 Latitude Water Repellency Wiper Blade, 22 Inch - 2 Pack","Sam A Craig Sr a.k.a Sneed4Real","Rain X","Reviewed in the United States on August 23, 2023","These were great on my car I had, I liked them a lot worked well when they finally are activated with the treatment of rain X.","5.0 out of 5 stars","3","Next page→","https://www.amazon.com/Rain-X-Latitude-Water-Repellency-Wiper/product-reviews/B084CT24NM/ref=cm_cr_arp_d_paging_btm_2?ie=UTF8&pageNumber=2"
"1693623545-21","https://www.amazon.com/Rain-X-Latitude-Water-Repellency-Wiper/product-reviews/B084CT24NM/","Rain-X - 810165 Latitude Water Repellency Wiper Blade, 22 Inch - 2 Pack","Brock Smith","Worked Perfectly, But Not For Very Long","Reviewed in the United States on July 23, 2023","Bought these for my 2005 Ford Taurus SE, and they were really easy to install. Had a video instruction on how to install for those who needed it. They worked really well on my car, but it was only a matter of a couple weeks before they started going out- requiring me to have to buy some more. Great quality product in my opinion, but did not last as long as I was expecting.","4.0 out of 5 stars","4","Next page→","https://www.amazon.com/Rain-X-Latitude-Water-Repellency-Wiper/product-reviews/B084CT24NM/ref=cm_cr_arp_d_paging_btm_3?ie=UTF8&pageNumber=3"
"1693623545-22","https://www.amazon.com/Rain-X-Latitude-Water-Repellency-Wiper/product-reviews/B084CT24NM/","Rain-X - 810165 Latitude Water Repellency Wiper Blade, 22 Inch - 2 Pack","A'sil","Easy installation","Reviewed in the United States on July 4, 2023","I've bought this before and it works & serve its purpose for the most part. However what I like about this brand is the engineering. There's no adapters whatsoever. You just snap it on, just poke that. And I like that the snap part is kinda bulky because it's more protective. I don't like the other brands where it's hard to install, all these adapters and some you snap on and you're part of the wiper is exposed. I'm a woman and most of the time I replace my wiper blades myself. But some of these are not built for women, I don't have the strength to pop something out or pull this in, etc. With these blades it's just pull out the old, snap in new.","5.0 out of 5 stars","4","Next page→","https://www.amazon.com/Rain-X-Latitude-Water-Repellency-Wiper/product-reviews/B084CT24NM/ref=cm_cr_arp_d_paging_btm_3?ie=UTF8&pageNumber=3"
"1693623545-23","https://www.amazon.com/Rain-X-Latitude-Water-Repellency-Wiper/product-reviews/B084CT24NM/","Rain-X - 810165 Latitude Water Repellency Wiper Blade, 22 Inch - 2 Pack","Marcus Lowell Tibesar","Amazon website clearly states these fit a 2011 Buick Lucerne","Reviewed in the United States on August 23, 2023","The 24"" Rain-X Latitude wiper blades do not fit my 2011 Buick Lucerne as stated by the Amazon website. They are too long.","5.0 out of 5 stars","4","Next page→","https://www.amazon.com/Rain-X-Latitude-Water-Repellency-Wiper/product-reviews/B084CT24NM/ref=cm_cr_arp_d_paging_btm_3?ie=UTF8&pageNumber=3"
"1693623545-24","https://www.amazon.com/Rain-X-Latitude-Water-Repellency-Wiper/product-reviews/B084CT24NM/","Rain-X - 810165 Latitude Water Repellency Wiper Blade, 22 Inch - 2 Pack","Nolan Dodson","Quick and Easy Installation","Reviewed in the United States on August 20, 2023","Came with instructions for various types of windshield wipers. Was quick and easy to find the right one and change the wiper connection for quick install.","5.0 out of 5 stars","4","Next page→","https://www.amazon.com/Rain-X-Latitude-Water-Repellency-Wiper/product-reviews/B084CT24NM/ref=cm_cr_arp_d_paging_btm_3?ie=UTF8&pageNumber=3"
"1693623545-25","https://www.amazon.com/Rain-X-Latitude-Water-Repellency-Wiper/product-reviews/B084CT24NM/","Rain-X - 810165 Latitude Water Repellency Wiper Blade, 22 Inch - 2 Pack","Jimmie Coins","Excellent wipers for all vehicles!","Reviewed in the United States on August 28, 2023","The wipers are very efficient, smooth, quiet and good quality.","5.0 out of 5 stars","4","Next page→","https://www.amazon.com/Rain-X-Latitude-Water-Repellency-Wiper/product-reviews/B084CT24NM/ref=cm_cr_arp_d_paging_btm_3?ie=UTF8&pageNumber=3"
"1693623545-26","https://www.amazon.com/Rain-X-Latitude-Water-Repellency-Wiper/product-reviews/B084CT24NM/","Rain-X - 810165 Latitude Water Repellency Wiper Blade, 22 Inch - 2 Pack","My dogs left pawed","Works great","Reviewed in the United States on August 2, 2023","I have a Toyota corolla and there was no correct explanation on how to put it on. You have to take the casing off completely and then put it on. Once I figured that out it was quick and easy. Works great in the rain.","5.0 out of 5 stars","4","Next page→","https://www.amazon.com/Rain-X-Latitude-Water-Repellency-Wiper/product-reviews/B084CT24NM/ref=cm_cr_arp_d_paging_btm_3?ie=UTF8&pageNumber=3"
"1693623545-27","https://www.amazon.com/Rain-X-Latitude-Water-Repellency-Wiper/product-reviews/B084CT24NM/","Rain-X - 810165 Latitude Water Repellency Wiper Blade, 22 Inch - 2 Pack","jjaanneettvv","Patience is a virtue-otherwise excellent so far","Reviewed in the United States on July 31, 2023","If you haven't (or even if you have like me) the instructions didn't make sense until you pried the pieces apart. I wish I took pictures so I could explain it better.  Otherwise they have been amazing on light rain and downpours.","4.0 out of 5 stars","4","Next page→","https://www.amazon.com/Rain-X-Latitude-Water-Repellency-Wiper/product-reviews/B084CT24NM/ref=cm_cr_arp_d_paging_btm_3?ie=UTF8&pageNumber=3"
"1693623545-28","https://www.amazon.com/Rain-X-Latitude-Water-Repellency-Wiper/product-reviews/B084CT24NM/","Rain-X - 810165 Latitude Water Repellency Wiper Blade, 22 Inch - 2 Pack","Steven Hill","water beads up as advertised","Reviewed in the United States on August 25, 2023","Useful video helps with installation.","4.0 out of 5 stars","4","Next page→","https://www.amazon.com/Rain-X-Latitude-Water-Repellency-Wiper/product-reviews/B084CT24NM/ref=cm_cr_arp_d_paging_btm_3?ie=UTF8&pageNumber=3"
"1693623545-29","https://www.amazon.com/Rain-X-Latitude-Water-Repellency-Wiper/product-reviews/B084CT24NM/","Rain-X - 810165 Latitude Water Repellency Wiper Blade, 22 Inch - 2 Pack","Amazon Customer","Works well","Reviewed in the United States on August 28, 2023","Work well and no streaks on my windshield","5.0 out of 5 stars","4","Next page→","https://www.amazon.com/Rain-X-Latitude-Water-Repellency-Wiper/product-reviews/B084CT24NM/ref=cm_cr_arp_d_paging_btm_3?ie=UTF8&pageNumber=3"
"1693623545-30","https://www.amazon.com/Rain-X-Latitude-Water-Repellency-Wiper/product-reviews/B084CT24NM/","Rain-X - 810165 Latitude Water Repellency Wiper Blade, 22 Inch - 2 Pack","Cody","Love it","Reviewed in the United States on August 24, 2023","Great product that was super easy to install and works like a charm!","5.0 out of 5 stars","4","Next page→","https://www.amazon.com/Rain-X-Latitude-Water-Repellency-Wiper/product-reviews/B084CT24NM/ref=cm_cr_arp_d_paging_btm_3?ie=UTF8&pageNumber=3"
"1693623545-31","https://www.amazon.com/Rain-X-Latitude-Water-Repellency-Wiper/product-reviews/B084CT24NM/","","","","","","","","Next page→","https://www.amazon.com/Rain-X-Latitude-Water-Repellency-Wiper/product-reviews/B084CT24NM/ref=cm_cr_arp_d_paging_btm_3?ie=UTF8&pageNumber=3"
