web-scraper-order,web-scraper-start-url,Product name,author,title,date,content,rating,Page no next,Next Page,Next Page-href
"1693623565-68","https://www.amazon.com/kindle-the-lightest-and-most-compact-kindle/product-reviews/B0B92489PD/","Kindle (2022 release) – The lightest and most compact Kindle, now with a 6” 300 ppi high-resolution display, and 2x the storage - Without Lockscreen Ads - Black","E. Krentz-Wee","Great device but serious limitation","Reviewed in the United States on August 23, 2023","I am mostly happy with this. I downgraded from an Oasis; I wanted the smaller size. It is indeed more comfortable in the hand. I use this daily and am content.
However, there are  things that do not live up to what this kindle is supposedly capable of:
1. It will never download my whole library. When it gets too many books on it, my only choice is to do a factory reset.*
The first sign of trouble is when I cannot download the book from the kindle device. Then I have to go to My Content and Devices on my Amazon account web page to send the book to kindle. At some point,  it cannot deliver a book.
Then the helpful tech support people will tell you to do a factory reset. You will erase all content, of course, and then it will need to do any upgrades from 2022 (in my case) when it was first released.
Note: I've never gotten 1,000 books on any kindle without this happening
2. If you have a lot of books, it is not able to organize your books by series. The apps on my iPhone and iPad organize them fine, but no longer on my kindle device.
What does this mean?
Don't spend extra money getting more storage. I never came close to using the 32Gb on the Oasis, and I still have over 11Gb free on this kindle. It doesn't matter: I will have to perform a factory reset long before I come close.
*I currently have 842 books downloaded; I own over 8000","4.0 out of 5 stars","2","",""
"1693623565-69","https://www.amazon.com/kindle-the-lightest-and-most-compact-kindle/product-reviews/B0B92489PD/","Kindle (2022 release) – The lightest and most compact Kindle, now with a 6” 300 ppi high-resolution display, and 2x the storage - Without Lockscreen Ads - Black","B Mac","Perfect for me","Reviewed in the United States on August 7, 2023","I haven't used an e-reader in a while, but wanted to get back into reading again, as it used to be quite a passion of mine. I much prefer this screen to my old Kindle Fire (which I HAVE used since I got this one for a free book I didn't want to read on my phone) as it's easier on the eyes and doesn't have much glare.

Features are very minimal, but that's perfectly fine for me.

As I've seen on other reviews, there's a delay between input and response, but that's to be expected with e-ink, as the screen has to refresh to change the image.

I saw one review that mentioned battery life at 50% after only 12 hours. I'd like to address this, as I thought I had the same issue at one point. I took my reader to work after using it for a few days and saw 48%, which I assumed was the battery level. It wasn't. It was how far I'd gotten in the book I was reading. My battery was at 65% when realized my goof and checked the next morning. The battery life is absolutely phenomenal compared to my Fire tablet.

Overall, I quite enjoy the reading experience with this Kindle. It's easy to use, has intuitive controls, and, best of all, has rekindled (no pun intended) my love for casual reading.","5.0 out of 5 stars","2","",""
"1693623565-70","https://www.amazon.com/kindle-the-lightest-and-most-compact-kindle/product-reviews/B0B92489PD/","Kindle (2022 release) – The lightest and most compact Kindle, now with a 6” 300 ppi high-resolution display, and 2x the storage - Without Lockscreen Ads - Black","Mary Peterson","Finally bit the bullet and it’s was a great choice","Reviewed in the United States on August 14, 2023","from january-june i read MAYBE 2 books. got the kindle and within the whole month of july i read 5 books, and they weren’t short books either. This is an introduction to e-readers for me but i know i made the right choice. sure the screen isn’t the biggest or best that the kindle range apparently has to offer, but for me i don’t NEED it since you can adjust the text size and all that jazz. if there is anything i had to complain about, and it’s totally minor, would be that the touch screen can be a little laggy and also a little sensitive at times, but like i said it’s genuinely a nitpick because it only happens every once in a while. i paired my kindle with a clear case and a pop socket like everyone on the internet seems to be doing and it hasn’t left my side. also they weren’t kidding when they said it has a long battery life. now obviously if you’re using it for hours on end, day after day, like i’ve been doing the battery isn’t going to last nearly has long on a single charge as it would if you were a more…”causal” reader, but even in my experience i can go WEEKS without having to charge it. 10/10 would recommend!","5.0 out of 5 stars","2","",""
"1693623565-71","https://www.amazon.com/kindle-the-lightest-and-most-compact-kindle/product-reviews/B0B92489PD/","Kindle (2022 release) – The lightest and most compact Kindle, now with a 6” 300 ppi high-resolution display, and 2x the storage - Without Lockscreen Ads - Black","skangirl","WITH PATIENCE, YOU CAN GET A GREAT PRICE! I prefer it over the newest, largest Paperwhite.","Reviewed in the United States on May 19, 2023","(Editing to reflect most recent purchase)

I bought 2 more of these Kindles on Prime day, paying $65 each for them. I paid $80 for the first one of this model, which was also a sale price. (When I purchased the first one, I also purchased the newest version of the Paperwhite, which I find awkwardly designed to hold with one small hand. I named that one ""Skippy"" because of its tendency to jump more than one page at a time. It's a complaint found in many reviews of that model.)

I have several older Kindles which have gotten a lot of use. Over time, it seems that they don't hold a charge as long as they did when they were new. I paid extra for the formerly-free 3G capability, which is no longer supported. (I think Amazon should give people credit if they paid the extra $20 or $30 for that feature.)

This Kindle and the new Paperwhite use a USB-C charging cable, which I prefer because there's no ""upside down, try again"" issue. It sounds trivial, but it's a plus, imho. Now I won't have to use 2 different cables, depending on which Kindle I'm charging.

I use several Kindles at a time: One in my purse (or 2 if I'm traveling where recharging is not an option). And 3 ""scattered"" around the house so that a Kindle is always within reach. I've also purchased others which I've given to my kids, loaded with books I think they would enjoy.

I'm not sure what makes this model *not* a Paperwhite. It has the features I love/need/use the most (adjustable fonts, adjustable light, built-in dictionary, note-taking capability, etc.). The slight difference in weight is actually noticeable--and appreciated by my arthritic hands.

I always purchase a magnetic cover that allows the device to wake up automatically when it is opened. (If you purchase on ebay, you'll find covers that are a lot cheaper than identical covers sold on Amazon.)

My original review:

It seems as if ""they"" constantly try to convince us that our devices (cell phones, tvs, computers, watches) are outdated technology. Too small, too large, too ""flippy"". This Kindle is probably as small as I'd want to go. If I wanted a smaller screen than this Kindle, I'd just use my phone.

(The latest Paperwhite is noticeably larger than this device and previous Paperwhites. My preferred technique of holding it with one hand is more awkward with a larger device. It feels unbalanced, top-heavy. The cover is larger, too, of course, which adds more weight. I have arthritis in my hands, so it probably bothers me more than others. If I'm using a Kindle easel or holding it on my lap, it doesn't matter. But for one-handed Kindling, I like this little model. It's my new ""travel Kindle"".)

I miss and resent the loss of free X-G for the Kindles. I paid extra for free 3G on my previous Kindles and it's useless now. It's not a huge hardship, but I have to remember to sync my devices before I leave the house. It can be a nuisance to find my place in my ""purse Kindle"" when I'm not home. (And Amazon loses out on those impulse purchases that I used to make when I finished a book and felt an urgent need to buy the sequel or something by the same author.)

In conclusion, this is my new, preferred Kindle. My Kindle collection will now consiste of 3 of these, plus the larger Paperwhite I call ""Skippy"".","5.0 out of 5 stars","2","",""
"1693623565-72","https://www.amazon.com/kindle-the-lightest-and-most-compact-kindle/product-reviews/B0B92489PD/","Kindle (2022 release) – The lightest and most compact Kindle, now with a 6” 300 ppi high-resolution display, and 2x the storage - Without Lockscreen Ads - Black","Robert's reviews","perfect upgrade","Reviewed in the United States on August 31, 2023","I enjoy reading, but carrying around books is a drag.  I was looking for something a bit larger than my phone, smaller than a tablet, and easier on my eyes.  This has been perfect for me.  Use it several days a week, it is easy to read on, I can carry it in backpack, or even in the cargo pocket of my pants.  Holds plenty of books, does not need internet connection, so reading anywhere is fine.  Battery life is incredible, I think I have charged it 2 or 3 times since I got it a few months ago.  Didn't need charging, just saw the plug and thought I would ""top it off"" while I had a plug handy.

4 stars as I thought there used to be a way to get the Washington post on it.  For a while, I think they were sending out a daily copy and delivering it to some of my devices, but I have not found a way to do that with this (read that they have stopped doing this).  Would have been a nice feature.  But if you like reading, or need to read for work, this is a great little device.","4.0 out of 5 stars","2","",""
"1693623570-73","https://www.amazon.com/kindle-the-lightest-and-most-compact-kindle/product-reviews/B0B92489PD/","Kindle (2022 release) – The lightest and most compact Kindle, now with a 6” 300 ppi high-resolution display, and 2x the storage - Without Lockscreen Ads - Black","Arthurian Tapestry","Surprisingly, this is the best kindle for me!!!","Reviewed in the United States on June 25, 2023","Just when the trend is going to bigger screens like the kindle scribe, I find myself leaning towards portability. In short, being able to carry my library literally in my pocket.

I’ve had several iterations of the e-ink kindles over the years, my least favorite being the popular paperwhite with which I’ve always encountered quality control issues and have always duly returned.

My favorite e-ink device for years was the kindle touch 4rth generation which looked better than any of the paperwhites I’ve ever come across with a rich text that made it pleasant to read, even though it has only 167 ppi. The Voyage with increased ppi replaced this, and I must confess that this had the best and richest contrast of a screen I’ve experienced ever. The Voyage truly makes look the paperwhites and some of the Oasis’ (not all) look blurry in comparison.

But with kindle basic, the richness of the text pops out from the screen and is a joy to hold, feeling even lighter and more portable than the Voyage. I hope amazon always keeps these nice smaller and lighter units, even if the device has to sacrifice the page turn buttons to do so.

I chose the denim, and truly love it. This reader seems to capture the best features of my previous kindles in terms of screen quality and size and portability.

I suspect that the rich screen contrast of this basic kindle is due in no small part to the lack of the waterproofing which adds another layer between the eye and the text (from what I have gathered in the forums).

Also, there is less lighting on this kindle. Personally, I would not have minded if they had done away built in light altogether and made a lighted case like they did with kindle touch. I did a comparison of the kindle touch with lighted cover alongside this kindle and the oasis with the warm light, and the kindle touch beat them all with maintaining clarity and crispness of of text. I don’t use the light much on the kindle, as I never seem to get the setting where I enjoy the clarity of the text. Using a reading light, like the ones you clip on a book, are much better imo. Thus, I don’t miss the warm light of the Oasis.

Suggestions to improve this kindle: Add the animated page turns, maybe a way to vertically scroll on the pages. I would also love a kindle home button like the kindle touch. But that’s it really.

Sidenote: In regard to waterproofing. Over the years, I’ve taken my non waterproof Voyage everywhere from beaches to swimming pools, and never experienced trouble, so if waterproofing really takes away from the quality of the screen, let the Oasis or paperwhite keep that market.

Additional sidenote: the kindle covers to this unit are reasonably priced and the blue cover matches the denim unit perfectly.

This kindle as a basic has just about everything I could wish for, namely in size and portability and clarity and contrast of text.","5.0 out of 5 stars","3","Next page→","https://www.amazon.com/kindle-the-lightest-and-most-compact-kindle/product-reviews/B0B92489PD/ref=cm_cr_arp_d_paging_btm_2?ie=UTF8&pageNumber=2"
"1693623570-74","https://www.amazon.com/kindle-the-lightest-and-most-compact-kindle/product-reviews/B0B92489PD/","Kindle (2022 release) – The lightest and most compact Kindle, now with a 6” 300 ppi high-resolution display, and 2x the storage - Without Lockscreen Ads - Black","Annie Freeman","Perfect for reading at night!","Reviewed in the United States on July 19, 2023","I grew up always reading in bed and just reading until I couldn't keep my eyes open anymore.  My wife is very sensitive to light in the bedroom though; she can tolerate my phone on lowest light and night setting but not the brightness of any book lights I've bought.  This is a perfect solution, and you can set it to dark mode such that the words are white and the page is black, which creates even less light overall and feels even easier on my eyes in the dark.

I also love the experimental browser.  I usually only read my news, not watch it, and I read from a lot of different sources.  Going to the news sites themselves is a lot for the browser, AP News can't ever load on mine while CNN generally can, but instead it works perfectly to Google the news source, go to the news tab where all of their articles will show up, click on what you want to read, and then go into articles mode.  It may seem like a mess to do, but the extra steps don't take long at all, and it's so much easier on my eyes to read articles on the Kindle as opposed to off of my phone.

I also love that you can access e-books from the public library on the Kindle.  You can find the e-book you want from your library, and it will take you to a link to rent it via Amazon so that it will appear on your Kindle and disappear when your check-in date comes.

I should have bought a Kindle years ago, but I also had renewed interest now with the browser, and it has met my expectations in allowing me to read news and books without waking my wife.","5.0 out of 5 stars","3","Next page→","https://www.amazon.com/kindle-the-lightest-and-most-compact-kindle/product-reviews/B0B92489PD/ref=cm_cr_arp_d_paging_btm_2?ie=UTF8&pageNumber=2"
"1693623570-75","https://www.amazon.com/kindle-the-lightest-and-most-compact-kindle/product-reviews/B0B92489PD/","Kindle (2022 release) – The lightest and most compact Kindle, now with a 6” 300 ppi high-resolution display, and 2x the storage - Without Lockscreen Ads - Black","Kati","Good overall","Reviewed in the United States on July 29, 2023","Overall, I love my kindle.

THE BAD:
The only thing that I really hate, is the store. The store is incredibly slow and glitchy. It takes forever to get to the book you want just because it freezes and glitches so much. Once you’ve found the book you want, downloading the book is very fast and easy - sort of makes up for the store being terrible. I usually just stay in the book once I have it downloaded, until I finish the book - I don’t exit out of the book each time I’m done reading - just because I don’t want to deal with the store and the library each time.

THE GOOD:
Once you are in the book and reading it - it is amazing. It is so convenient and I love that there are so many customization options (fonts, font sizes, 25 brightness levels, etc). My absolute favorite thing about the kindle is that it literally stays charged forever. I read for about 2 or 3 hours every day. I received my kindle at the beginning of July, charged it fully at that time - and I haven’t charged it since (today is the 29th of July) - it’s still on 58% charge. It has truly shocked me how long this thing stays charged. I love it.

MIXED FEELINGS:
It takes some time to get used to. When you “turn it off” - the screen is darker but it stays on with recommendations of other books. I was honestly quite confused when the screen didn’t go black or “turn off” how normal phones or iPads do. This took some time to get used to and I’m still not sure how I feel about it. But overall, I really enjoy reading on my kindle - I just wish they would make the store and library a bit faster and less glitchy.","4.0 out of 5 stars","3","Next page→","https://www.amazon.com/kindle-the-lightest-and-most-compact-kindle/product-reviews/B0B92489PD/ref=cm_cr_arp_d_paging_btm_2?ie=UTF8&pageNumber=2"
"1693623570-76","https://www.amazon.com/kindle-the-lightest-and-most-compact-kindle/product-reviews/B0B92489PD/","Kindle (2022 release) – The lightest and most compact Kindle, now with a 6” 300 ppi high-resolution display, and 2x the storage - Without Lockscreen Ads - Black","PhotoGraphics","Is this really all you need","Reviewed in the United States on July 14, 2023","With over 7000 reviews of this model if you find mine it may not be what you expect. I find that most reviews of this line of readers almost always come from avid users of the brand who either are excited about certain improvements or angry that it's not what it used to be. I actually had one of those original ones with the keyboard and it was dead for a long time. I had a new battery put in, knowing that I could have bought a brand new one for the same price, and it was still dead. I think eventually the e-ink simply gives up and can't make an image. It's shame because those were pretty nice units. Before I bought this one on sale on Prime Day I read an excellent article about e-readers as a category, not just Kindles, and learned some solid truths that weren't written by a press agent. Once this model was introduced the more expensive ones really don't buy you much more in dollar value and some of the so called features can really work against you. There's no escaping it - to be able to just grab your Kindle anywhere at any time this model is all you need and easily the most convenient. The quirks? Sure we all know about them and after all these years and with all of the advances in technology they are massively overpriced and under engineered. But it is a continuous profit stream for them so why mess with it? At the sixty-four bucks I got this for it is only about three times overpriced, they should be going for no more than twenty five bucks and the accessories are through the roof as well. But if you really want to tote a couple of hundred books around with you and have them fit in your pocket, there is still nothing better than this basic model.

YES NO MAYBE

For the closing argument I gathered the three most often cited complaints, or negatives, about the basic Kindle and being an owner here's my opinion on them. No waterproofing (oh really, and just how many paper books have you read in the swimming pool?)  No color temperature adjustment (same question, when was the last time you read a paper book and changed the color of the page from white to orange?) And finally, raised bezel design (no really, this is among the top three complaints, I can't even come up with a comeback for that one, Virtually every TV and computer monitor screen has a bezel, why did it get to be a problem if your Kindle has one?

Stop reading other people's opinions and buy one and go sit under a tree and read an interesting book.","5.0 out of 5 stars","3","Next page→","https://www.amazon.com/kindle-the-lightest-and-most-compact-kindle/product-reviews/B0B92489PD/ref=cm_cr_arp_d_paging_btm_2?ie=UTF8&pageNumber=2"
"1693623570-77","https://www.amazon.com/kindle-the-lightest-and-most-compact-kindle/product-reviews/B0B92489PD/","Kindle (2022 release) – The lightest and most compact Kindle, now with a 6” 300 ppi high-resolution display, and 2x the storage - Without Lockscreen Ads - Black","Keturah Moten","Good investment","Reviewed in the United States on August 21, 2023","I’ve seen so many TikTok videos on a kindle and I was very influenced to buy one and I don’t regret it!! If you love reading just get one. It’s a good purchase and you can get thousands of books!! I have kindle unlimited and it’s the best. Even without it you can get books from you library and transfer them to your kindle for free!!

The back light is the best. It could be pitch black in my room and even with my kindle brightness all the way down I can still see just fine. Sometimes it’s brighter than I need it to be but it’s the best.
Again, If you love reading, get a kindle. It’s a good investment and cheaper in the long run if you always buy physical books!!

The battery life is amazing. I charged it one time and it lasted a whole week. It’s small enough to fit in my hand but big enough to read","5.0 out of 5 stars","3","Next page→","https://www.amazon.com/kindle-the-lightest-and-most-compact-kindle/product-reviews/B0B92489PD/ref=cm_cr_arp_d_paging_btm_2?ie=UTF8&pageNumber=2"
"1693623570-78","https://www.amazon.com/kindle-the-lightest-and-most-compact-kindle/product-reviews/B0B92489PD/","Kindle (2022 release) – The lightest and most compact Kindle, now with a 6” 300 ppi high-resolution display, and 2x the storage - Without Lockscreen Ads - Black","RMWARZ","My Old Eyes are Thanking Me","Reviewed in the United States on August 16, 2023","For about 15 years, I happily read eBooks through apps on my phone or my 2-in-1 tablet computer.  Lately, my aging eyes have found the print on the phone screen too small, and my hands and arms have found the tablet tiring to hold.  As a result, my reading sessions were getting shorter and shorter.  When Prime Day rolled around, I took advantage of the bargain price to purchase a basic Kindle.  The e-ink screen is easy on my eyes, and the device’s light weight makes it comfortable for me to hold, especially since I have very small hands.  Set-up was a cinch.  Perhaps because of long experience with e-reading apps, I found customizing fonts and layout easy and tapping to turn pages second nature.  Thanks to the Kindle, I am reading much more again, and that makes me happy since I’ve been a voracious reader all my life.","5.0 out of 5 stars","3","Next page→","https://www.amazon.com/kindle-the-lightest-and-most-compact-kindle/product-reviews/B0B92489PD/ref=cm_cr_arp_d_paging_btm_2?ie=UTF8&pageNumber=2"
"1693623570-79","https://www.amazon.com/kindle-the-lightest-and-most-compact-kindle/product-reviews/B0B92489PD/","Kindle (2022 release) – The lightest and most compact Kindle, now with a 6” 300 ppi high-resolution display, and 2x the storage - Without Lockscreen Ads - Black","Sofia","I love my kindle","Reviewed in the United States on August 19, 2023","I was debating for a long time if I should get the paper white or this kindle. I ultimately decided on the kindle basic and I honestly think it’s perfect for me. Don’t get me wrong the sleek look of the paper white is great. But for me the size of the kindle basic was perfect. I have very small hands but I can comfortably hold my kindle with a pop socket and not get tired. Not very laggy and does everything every other kindle does so unless you plan on reading under water this does pretty much what paper white can do for cheaper. I mean just look at how cute my kindle looks 🤭🤭🤭 (if you mostly like to read manga I recommend the paper white because this kindle is quite small and the writing can be hard to read or some scenes may be hard to see) I love my kindle and so far I’m 3 books in and have had it for only 2 days 💀💀🤚🏽","5.0 out of 5 stars","3","Next page→","https://www.amazon.com/kindle-the-lightest-and-most-compact-kindle/product-reviews/B0B92489PD/ref=cm_cr_arp_d_paging_btm_2?ie=UTF8&pageNumber=2"
